file_name,transcription
740.mp3,But not moving and always keeping to old things cannot improve a persons life . 
741.mp3,Local communities have the main role of protecting children if such children are their own children or not . 
742.mp3,"if they are urged to understand the concept that is being passed and interact with the information , the learning process will take place in a completely different way . "
743.mp3,"How they found their work place or foods , so they had no space for their communities in their mind . "
744.mp3,His success belongs to his new try . 
745.mp3,"But if one who majors in art also learns something about natural science , he will be lucky to be equipped with the ability to think more logically . "
746.mp3,Movies and oher television show provides o lot of information about how real life is . 
747.mp3,There is many way for this another examples bottele of juise if its tast bad they make thier shape wonderful like making it colourful . 
748.mp3,It is because they do not think the new thing to promote or make the people feel very good . 
749.mp3,Other tourists would teach you some tips for the travel with thier experience . 
750.mp3,The government also should try to reduce the striped bass population . 
751.mp3,Alot of memories with enogh time to remember will increase the posibilty of enjoyment . 
752.mp3,Sceene of violence can affect on them . 
753.mp3,While the communities in general have reckoned that they need support from the young people but must have made an appeal of it in a reaonable sense . 
754.mp3,New and new technology has been introduced to the society .
755.mp3,One possible outcome is that an environmentally-induced reduction in motorization levels in the richer countries will outweigh any rise in motorization levels in the poorer countries .
756.mp3,"Every person needs to know a bit about math , sciences , arts , literature and history in order to stand out in society ."
757.mp3,"While the travel company will most likely show them some interesting sites in order for their customers to advertise for their company to their family and friends , it is highly unlikely , that the company will tell about the sites that were not included in the tour -- for example due to entrance fees that would make the total package price overly expensive ."
758.mp3,Disadvantage is parking their car is very difficult .
759.mp3,Bigger farming are use more chemical product and substance to feed fish .
760.mp3,"Forexample , My cousin is 12years old ."
761.mp3,"if it does , you will only get some misundrestood idea about that acticle but not the original one ."
762.mp3,"Secondly , chimp can also present the capability for grammer which means it can demonstrate the ability to combine words and be able to use grammatical constructions ."
763.mp3,"Nevertheless , this city is having a big change ."
764.mp3,"I think to learn facts is only an evidence if the students can work hard and if they are able to keep every detailled information as tought , but it 's definitly not an evidence for their intelligence ."
765.mp3,"Unforturntly , almost older people can not use internet , in spite of benefit of internet ."
766.mp3,"So , if i have alot of information about this subject , i will taulk too much with knowledge but if i have general information for this subject , i will talk about this subjec with my limited knowlege and this case may be make me shame like when my brother asked me about some thing but i have not alot of information about this thing ."
767.mp3,becuse if i see some one did somthing to may safe me time and engy and it wok 's i will do it .
768.mp3,The government should think about the whole nature .
769.mp3,They will not be able to compete with other similar brands and the product will fizzle out or die .
770.mp3,People are now opening their eyes to the scenario when we would run out of fuel .
771.mp3,For me it was great because I need to talk on the phone locally and nationally for long periods of time .
772.mp3,They only care if the effects are good and popular among the crowds .
773.mp3,"That is why calculated risks , as one could call them , are the predecessors of big success , because they get people 's attention by giving people new options ."
774.mp3,"He said in other words that the more flouride may create damage in human body , specifically the bone ."
775.mp3,When these people create their new ideas others often look very strange on them .
776.mp3,You will learn to socialize with people .
777.mp3,"No ohter transportation concept has been as successful as the car , not only because the goog street and highway system throughout the United States and Europe , but only because off the fact , that people love their cars ."
778.mp3,"If they prefer to choose cars than motor bike , that means there will be many cars ."
779.mp3,That 's why he is a legend in these days and people repect him .
780.mp3,"for example , in math club , teachers usually teach us how to solve a math problem using vary ways ."
781.mp3,"In order hand , when I was a fresh man in my college , I could concentrate on my favorit subjects ."
782.mp3,I have an IBM computer and my laptop is DELL .
783.mp3,Air in China is not so clean because of cars .
784.mp3,"When price of gas goes up , the consumer do not want buy gas for fuels ."
785.mp3,"although , learning more subjects gives us a huge knowledge which is make me sucssesfu in my study ."
786.mp3,"When you`re making a tour guide trip , you already have a everything settled from the time you`re departing to the time you arrive ."
787.mp3,"On the other hand , although in Turkey the public transportation is getting developed especially in the two big cities , that is , Ankara and istanbul , it is still nothing compared to Sweden ."
788.mp3,This rebuffs the reading passage 's claim that there is no improvement .
789.mp3,"As they are involved with study , they donot get enough time to look after their community ."
790.mp3,"However , I strongly maintained that traveling by their own gives a lot of advantages ."
791.mp3,The even ask themself how this kind of things did n't cross their mind .
792.mp3,"People tends to choose other medias , and that is why litterature is in danger ."
793.mp3,I cast doubt that twenty years is too short time to prove the problem .
794.mp3,"So for these reasons i really believe that it 's important to have a broad knowledge on different subjects , instead of being focused on just one , because sometime the answer that we are searching for , we can easily find it in a field that can seems not related to our purpose ."
795.mp3,I am pleased to know intelligent peple and learn about things which I do n't know .
796.mp3,"To resolve this problem , the governments of the cities are likely to improve the public transportation system by building new subway system and adding more lines for buses ."
797.mp3,"I know lots of old people who go to parties , stay always in contact with others people ."
798.mp3,"But these thing seem to hard for old people , they move so hardly , and do n't have health body to play this thing like sports ."
799.mp3,"For example , if you understand the idea that all diseases , caused by microorganisms , are treated with the antibiotics , you will never use antidepressants ."
800.mp3,"I like about that , but after that it 's gradually starting boring and finally I did n't have interesting about all the stuff ."
801.mp3,"In her salary we cant buy some car because we are planing to finish our hause in Binangonan , Rizal and we will planing to finish my study in Boston ."
802.mp3,so the information technology and advanced technology are so much increased .
803.mp3,"Even more relevant to the seduction of advertisement is the fact that quite frequently those images of perfection placed in front of our eyes are just mirages and illusions , bodies touched up by computer programs and therefore , they do not resemble reality at all ."
804.mp3,"As the professor claimed the details and examples to strengthen the position of reading passage , which I , in the following pargarghs , would like to provide the evidence to present the whole views ."
805.mp3,"In the advertisement that he shows in the media , newspapers , magazines , and public spaces , he clearly says that the product is made with products of high quality in technology ."
806.mp3,We have a lot of paper have to write .
807.mp3,A person with broad knowlege will help him to renovate .
808.mp3,The development of biomechanics has made this possible .
809.mp3,This inadequate amount of fuel force us to use less cars .
810.mp3,One of this important element is internet .
811.mp3,"You can only be successfull by learning new stuff and trying it too , by being an open and creative mind ."
812.mp3,"Firstly the striped bass consume large quantitiy of menhaden , secondly this fish is also a source of protein for farm animal , and fishing industry gives work some people in Virginia ."
813.mp3,They were drove settlements in other domain .
814.mp3,"The time line about this danger , which i have already given in the above discussion is so predictable that one can have even calculations about it if he/she has both the population and existing fuel count ."
815.mp3,I think people should travel by making decision by themselves with sevral reasons .
816.mp3,"Indeed , they threat lot of freshwater fish species because they need to eat and to find different kind of food in the oceans ."
817.mp3,"For example , if the city says that 8am~9 am is the most busiest time , than worker would argues that they drive a bit later"
818.mp3,Educators should provide opportunities for them to learn enough knowledge to survive the real world .
819.mp3,"For example , when I am studying for tests or doing my homework , my grandparents can go out and do what they enjoy ."
820.mp3,traditional enclopedias are written by trained expert for academic rigor that can not really achieve .
821.mp3,By the time up everyone should be gathered up in a certain place .
822.mp3,"Else twenty years down the lane every major city would end up being a pile of metal junkyard , with no place to move around ."
823.mp3,And what are those risks ?
824.mp3,"In contrast , the speaker casts doubt on the conclusion ."
825.mp3,In this movie father has handicapped .
826.mp3,"Fo example , in this genaration people watch movies and listen to musics more than read books and novels ."
827.mp3,"In malysia , there are a lot of cars ."
828.mp3,"So they are free to do all sorts of things , even if thez are cinsidered as dangerous or irrisponsble , such as bungee-jumping ."
829.mp3,"I think most of the people will like that in a busy world , but I don`t thing it will happen the next twenty years ."
830.mp3,"Every one would expect to leave his owns and secrets dreams like to be a painter , a writter ..."
831.mp3,I ANSWERED THE QUESTION AND I GOT GOOD IMPRESSION FROM BOTH LECTURER AND FRIENDS .
832.mp3,"While , according to listening passage it seems fair for people te increase the tax price because they will be able to save money for other taxes they pay ."
833.mp3,Home work will help you to manage your time if not you might be using those time in some other purposes .
834.mp3,I mean our homecontry because we can speak Japanese and can use Japanese .
835.mp3,New kinds of vehicles will be invented with new technology than today .
836.mp3,This would have definately required him to take out immense amount of time from his work and he stands as a perfect example with whom the youngsters of today relate .
837.mp3,They follow the way the Sun goes from the east to the west .
838.mp3,it 's the time to take a rest looking back in your present .
839.mp3,"I thought it is kind of ridicurous , but we have to do as tour guide said ."
840.mp3,"So , if Japan has such common sense since long time ago , even after twenty years for sure , people will aim to own a car and still ride a car to show people that they are `` rich '' ."
841.mp3,An example that would make this categorization problemmatic is an architect .
842.mp3,The incoming generation will not ride a two wheeler .
843.mp3,And also the markting can do some adjust about the changing .
844.mp3,"This is supported by national and internation policy which is presenting attractively the advantages of going abroad , make self-experiences in other countries and cultures , learning foreign-languages while staying in a country where this language is spoken , and so on ."
845.mp3,"Even if we are failed , We have to try to get a new things ."
846.mp3,He explained that the methane which is derived is a non biological process .
847.mp3,"I put into this group of people , everyone who have arrive to that success with his own work , i mean people who work very hard and try for example to develop new kinds of work , of technologies or someone who tries to do his work in another way to arrive the goal that he want easily ."
848.mp3,Confidence comes naturally since perfection is its along .
849.mp3,Reasons is pay for them and teach the more than other institute .
850.mp3,I totally agree that the youth today are not sparing sufficient time helping their communities .
851.mp3,"Nowadays , the society is changing drasticly ."
852.mp3,"and through text book , students are more engaged ."
853.mp3,"On the other hand , a chef that try new tastes will be recognize and he or she will gain a place in the cooking world ."
854.mp3,"Also , I think we will thank this animals to everything that they have done to us no matter what ."
855.mp3,"When I grow up , I start to understand what he said is quite right ."
856.mp3,Other one is a gambler which means that people always try the new things and take risks .
857.mp3,"Last month , I needed to buy digtal-camera ."
858.mp3,In the world oil price very high right now .
859.mp3,The cause of the Tunguska explosion is asteroid .
860.mp3,"after we know and learn the facts , it will be easier for us to understand ideas and concepts ."
861.mp3,they did not get the ideas or any concepts about what they learn .
862.mp3,"And at the end , if you take a risk and you success in that , you surely will become a successful person with all the merits , and maybe also the awards , you merit ."
863.mp3,In my essy i want to focus on : how impotant is for students to learn facts .
864.mp3,I naturally get to know that I do n't really want to know .
865.mp3,Let 's say your interest lies in paintings .
866.mp3,"However , what makes a student excellent is to both understand the concept and learn the facts ."
867.mp3,lrenikg the studens the ideas have many advantegis :
868.mp3,Do I want to risk my 2 years savings for a trip to Spain or do I want to use my kids college fund to start up my business ?
869.mp3,So even the government is expecting the increase in the use of four wheeler .
870.mp3,and you can have chanse to make a your person to help you .
871.mp3,He or she would not be able to discuss spesific problems just because he does not know them .
872.mp3,"For example when I went to Bangkok , Thailand few years ago , I experienced I was a stranger in downtown ."
873.mp3,I have specific reasons for this .
874.mp3,Actually it might not be true .
875.mp3,We still have to burn down forest to make land for farming and the result is bird will lose more of their habitat .
876.mp3,"By the same token , people will learn many different intellages by doing so many things but they just learn it 's appeals not get any crutial informations and wisdom form it ."
877.mp3,"On the other hand , if you specialize in one specific subject such as physics you will never help him ."
878.mp3,This is how we can hit the job market very early and proof that we are capable of doing job in an better manner .
879.mp3,To judge a person 's contribution in terms of time would be specious .
880.mp3,"New experiences to somebory is the same of the challenger and challenger is moviment , rason to some people been continue living ."
881.mp3,"our social wil be a lovely social , If the dram can cometure i think we must learn more knowledge ."
882.mp3,For example when you read your school 's book as a first time you will not understand any thing but when read it second time you understand it .
883.mp3,This is the goverment rule that they have compulsory attand this seminar .
884.mp3,"They might put it on the label , but they do n't say it on tv advertising ."
885.mp3,"For example , Many scientists and engineers are study about cars that make no more tough sound , and smoke ."
886.mp3,"Without the empirical experience , i think , the learner tend to forget all the information he or she have learned throuhout his or her learning process in a long term ."
887.mp3,"First , disking can be an alternative to prescribed burning ."
888.mp3,"By just knowing culture of a different country that we are living and not born on , we wo n't be able to live ."
889.mp3,somebody who no give ans just take can not live within communities .
890.mp3,Court coats are very high and many number of desputed tickets are seen .
891.mp3,And what is more effective than loads of people working towards the same aim ?
892.mp3,If we have this quality then no one can beat us .
893.mp3,you have 30 typically an effective response will contain a minimum you will be satisfiy culture expienrence and and fit your test .
894.mp3,"But I only use this solfware to win a lot of prize , some of them have important influence in my country ."
895.mp3,"If the sharp can not catch you mind , how can they sell the products to customer ."
896.mp3,The cutting the dead trees is called salvage logging .
897.mp3,"that 's why centralized , attributes , and bussines owner reduce thir bussinis is not respond for the rise of factories ."
898.mp3,"second birds navigate by landmarks like river , coastlines , and moutains ."
899.mp3,"A tour guide is generally a person who knows a great deal about the country , its most beautiful places , most visited ones , and the so on ."
900.mp3,They have to contact variety fields to find out what their interests are .
901.mp3,Unfortunately in the most of the countries the functioning of the public transport is not perfecty organised .
902.mp3,"If you think of the consumtions of them , fishes have less fat and a lot of nutrients there ."
903.mp3,The public transpotation in the city may not be able to cope with this huge amount of people flow .
904.mp3,"Second , we learn many academic subjects , after that we learn specialize in one specific subject ."
905.mp3,This does n't mean that because you take risks you are going to succed .
906.mp3,one of the most important problem is accidents for sure everyday millions of people dies jus because of the drivers not being carefull as a matter affect i do believe that there will be less cars in twenty years but this will happen just for one reasen that we will use somethink else .
907.mp3,"internet offer a good opportunity for people that travel for work , for a student , for work ."
908.mp3,Can you ever visualize what a chaos our society would suffer if every individual considers himself/ herself an expert in every given field ?
909.mp3,"In this sense , I would introduce the concepts of two aspects with a datailed analysis , and then it will comes to the conclusion ."
910.mp3,"In my case , my yonger brother need to more than academic knowledge ."
911.mp3,"Due to this , I feel that specialized students have more opportunity in future ."
912.mp3,Moreover before the oil and gas gone scientist will make new car that go by electricity or by sun light .
913.mp3,"However , I firmly believe that students have to learn broad knowledge of many academic subjects ."
914.mp3,"I larned many kind of subject , also I could make difrent types friends ."
915.mp3,"On top of that , even we are willing to spend the time to draft the travel plan , we have no idea on which travel sites are must-see ."
916.mp3,"They need to have a global vision before deciding what the like , and the way of obtaining it is simply studying a broad syllabus ."
917.mp3,"In order to understand these , and more importantly , to link these together , that wisdom will duly serve him ."
918.mp3,We can use it .
919.mp3,Some people can encounter with people we have no idea about .
920.mp3,"When my grandmother getting old , she could not move her body easily ."
921.mp3,"As a tour guide , the person has to be familiar with the place he or she is touring ."
922.mp3,Three other costumer have not started using the product because they dont have anything to hang it with .
923.mp3,And in the place where there is no train we can not help using cars .
924.mp3,you have to teach your child since he or she was antel they graw up .
925.mp3,If students have to study for history for example it is often enough to just learn the facts but on the other hand studing for physics or maths needs the understanding of the concepts .
926.mp3,"For example , the subway in New York , bullet trains in Japan , underground tube trains in Singapore and the sky trains in Bangkok travel at lightening speed ."
927.mp3,"First , young people have a active mind ."
928.mp3,Obviously the unreplaciable examination and less enemy can bring huge advance to fulfill the defination about success .
929.mp3,Young people nowdays do n't give enough time to helping their communities .
930.mp3,The commercial was defenately more impressive than the product itself .
931.mp3,And one of them was my friend who had seriouse prblems with her health .
932.mp3,"To this day , I still remember what we studied that day in class ."
933.mp3,Ihad good life in my cauntry but everything I got from my patents .
934.mp3,But if the student is going only learning things whithout knowing the concept then not any company is give apportunity to that person because he does not know the concept of its related branch so by this way its create a problem in the future .
935.mp3,"Third , stone tower of east coast is making unnatural way also this tower is unusual in Europe so non Europian might be made this tower ."
936.mp3,"secondly , it is an unfair action because it will effect the low-income American ."
937.mp3,The factories are increasing sulfur dioxide to the air every year .
938.mp3,"It`s result in people more mature , strong and calm in front problems of the life , because they undertand the problems go away and it depend what kind manner everybory look the face of the problem ."
939.mp3,"for example work on a project , ."
940.mp3,this speace must change gerden .
941.mp3,"However , exist people that thing that when the people have a forty years ever a older person ."
942.mp3,"It is worthy of note that not every body will succeed when taking a risk , but that is not enough to deteir anybody who wishes to take one ."
943.mp3,"apparently , I got a Japanese friend in the Japen , his name is Tomo ."
944.mp3,when they do some work they thinks they have to fine work in time .
945.mp3,"As the gasoline tax rasing , it will help the vehicle company to make more cars to sell it to people ."
946.mp3,Ignorance of striped bass will abbreviate our earning also it has some astonishing effects on our health .
947.mp3,Maybe they have some disadvantages in humanity .
948.mp3,"In the lecture , that zebra mussel is not really a serious threat have been proven ."
949.mp3,I think it will be lost .
950.mp3,I expect human can make new material to replace gas but it is very difficult .
951.mp3,Ideas and motives for the war are more important to know because from them one might draw some conclusions and it might change something inside the student .
952.mp3,Everything is possible which we can`t imagine .
953.mp3,"Although there are some rules for protect young peopel such as limiting of aging in movies and preview about the bad aspect of programs before s , it is just made for little kids not young peole like high shcool or university student ."
954.mp3,"However , the fact that they most of the time do not reflect the actual quality of a product decreases the reliability of the advertisements ."
955.mp3,We seem to have a lot of problem with those even if we have more good materials than in the past .
956.mp3,"We can be fatalist an say that with the developing of the third world , the problem will worsen ."
957.mp3,"This things can make us more successful in life ; even though were that successful we must continue are work , we should take our chances to the greater heights ."
958.mp3,"For the greeks philosopher Plato an Aristotle , the capacity for understand ideas and concepts , the intelligence as the main ability of the human soul , is the part of ourselves that makes us the being we actually are ."
959.mp3,"In conclusion understanding the concepts is the more important than learning the facts , because it 's the ultimate gole of learning the facts ."
960.mp3,I basically feel that young people do enjoy their life more than older people do .
961.mp3,"First , the ships not only helped them to spread but also they killed by ships ."
962.mp3,they might be bored of reading a complex passage .
963.mp3,But it is possible to have a broad knowledge of many academis subjects without being specialized in one particular topic ?
964.mp3,So she decides to work in a Nursing Home because she wants to provide care for elderly people .
965.mp3,This demonstrates the undeniable fact that it is bebeficial to having differnt experiences .
966.mp3,"Therefore , they will be more deep thinking person and good for thier future , so theacher should be required to take courses every five years ."
967.mp3,"In my case , I am working more than 200 hours a month , in order to get money required to pay back to a bank ( I borrowed some money for buying my house . ) ."
968.mp3,"because , student must do homework ."
969.mp3,it 's make a good partner .
970.mp3,"As a result , she could get a job that she badly wanted but she did n't expected because many people were flock to this company ."
