file_name,transcription
0.mp3,So I think we can not live if old people could not find siences and tecnologies and they did not developped . 
1.mp3,For not use car . 
2.mp3,Here was no promise of morning except that we looked up through the trees we saw how low the forest had swung . 
3.mp3,Thus even today sex is considered as the least important topic in many parts of India . 
4.mp3,"image you salf you are wark in factory just to do one thing like pot taire on car if they fire you you will destroy , becouse u dont know more than pot taire in car . "
5.mp3,"They draw the consumers , like me , to purchase this great product with all these amazing ingredients and all that but actually they just sometimes make something up just to increase their sales . "
6.mp3,"I want to talk about nocive or bad products like alcohol , hair spray and cigarrets . "
7.mp3,For example they can play football whenever they want but the olders can not . 
8.mp3,"It figures Diana Krall wearing a Rolex watch and has a text that suggests that if the reader wants to belong to the restricted club , not necessarily of Rolex watch wearers , but of highly talented , sophisticated and competent artists , he or she should also have a Rolex . "
9.mp3,There are several reason . 
10.mp3,"Also the work of the media , television , magazines , and every stuff made for publicity affects the emotions of many people around the world , encouraging them to buy and buy anything they can . "
11.mp3,"Since most urban areas are occupied with cars , they are all facing up with an irresistible problem of air and noise pollution . "
12.mp3,"It is true that consumers preffer to buy a product that has a lower price , but when international companies that has already the certification begins to send its market , people will preffer to consume theirs because the difference between prices is probbably not going to affect them to much . "
13.mp3,4:they have a big chance to prepare for their future life 
14.mp3,One person if do n't have good health that means so many things they could lost . 
15.mp3,Many studies over the last 5 0 years have shown that people who have fluoride in their drinking water are considerably have less cavities than people who have not drinking nonfluoridated water . 
16.mp3,"Likewise , The theory generating from the concept of memory is also not the appropriate way due to limited memory . "
17.mp3,because they spent time unmeaningful subjects . 
18.mp3,"I was very fast , my best time was 5 5 seconds in 4 0 0 hundred meters is a good time in or country . "
19.mp3,And young people spend time more ther lifestile . 
20.mp3,If in this society who will not to do study they never concept there opportunity or ca n't understand any ideas so most of the important that in this situation and I also very interestion and also prefer that for the study material . 
21.mp3,We have to know this problem it 's serious but almost people doens't know about this . 
22.mp3,Students can focus on only a few subjects they are intwerested in and they will become an experts in those areas . 
23.mp3,"But in other waythismakes other way country need to pay extra money to make , repair the roads What they did is reduce the amount of gas consumers , high the gas tax , and low the income tax because they thought , only rise the gas tax is unfair . "
24.mp3,"Today , MBA students with a background in engineering are in high demand . "
25.mp3,In the case of young people the best way is studying as hard as possible to get better grades so in the future they will have better chance to find better jobs . 
26.mp3,So the school try learning the students a bit in every science exist . 
27.mp3,I think they have to get skill on it . 
28.mp3,Specializing in one particular subject does not suit our life in this era which is characterized by diversity and innovation 
29.mp3,I will explain my points of views in the following paragraphs . 
30.mp3,He thinks differently from other people and he succeded . 
31.mp3,These activities make the community a better place to live in and inculcate these values in all the members . 
32.mp3,Beacuse all those broad knowledge help they to understand their major in university as well as help they to make a correct choice in specializing study . 
33.mp3,And it was very easy to me to understand why he always brang bad marks at home . 
34.mp3,"Then when we went to the Science Olympiad , she could have diverse knowledges about the subects and it was not new for her to think about new things . "
35.mp3,"If every people thinks to learn and understand lots of scientifc subjects , any person will do not do it and as a result of this any science is n't imporeved . "
36.mp3,Thus in concordance with the above I agree whole heartedly that in twenty years there will be fewer cars in use than there are today . 
37.mp3,Third the butt it in hte front of the door of store to make the poeple see it even if it is not good 
38.mp3,"However , are these things all good to people ? "
39.mp3,Very soon they will run out at the current rate of utilisation . 
40.mp3,"In the lecture , however , professor oppose the reading statement . "
41.mp3,But YOU have to create these opportunities . 
42.mp3,Throughts our lives needs talk about our familys . 
43.mp3,They try new things . 
44.mp3,"Inorder to do this , they would need to learn additionally skills , either theoretical or practical , that would increase their understanding and future application of their chosen subject . "
45.mp3,if you want a product you give create a beautiful image around it if you want sell it . 
46.mp3,Secondly the place of the film must must be very clear and chir must be relax etc . 
47.mp3,and will put you maind on a non-stop learning ... 
48.mp3,this will the proof of speeding offense so that polices can easily catch them. . 
49.mp3,In today 's Compuer skill is first important life skill . 
50.mp3,He last choosed to learn truth . 
51.mp3,"I never have stopped myself to think this , but this is a real possibility for the fucture . "
52.mp3,"Young has his own field and word on it hard , and do more benefits to the society . "
53.mp3,and about the new information there is editors . 
54.mp3,"If we conseder an idea as a totally autonomous concept within the individual process of defining reality , I will state that ideas are useless , not being based on experience . "
55.mp3,"He/she wants to know everything about the universe , wants to know everything about the God , the death etc. these some concepts that everyone can encourage a lot of ideas but the facts are not found yet . "
56.mp3,It so expensive that only those people can do this besides of their allday living . 
57.mp3,They make very high profits year after yaer and the numbers also increase year after year . 
58.mp3,"For this reason , the number of cars would be decrease in the future . "
59.mp3,So he took upon himself to narrow his research on this subject which was a mystery to the world . 
60.mp3,Others who do n't have this concept they will sell uncerfied wood . 
61.mp3,I did n't have self-confidence . 
62.mp3,"If there are specialized docters , the docter has done the operation very often before , so he is really talented in his job . "
63.mp3,So It will be good situstion . 
64.mp3,"Also , I have traveled in a group without tour guide . "
65.mp3,the school teachers there the one who take the future of youg genaration so we have to give them to get the better knowledge . 
66.mp3,so this test is very important with theirs . 
67.mp3,but most time it is important because most student is not baly and his think and ideas is very important . 
68.mp3,"Otherwise , it will be a problem for us to understand certain thing in life . "
69.mp3,I myself like to participate in kind of activities and meet many people who would like to do . 
70.mp3,Second the amount of treasure locations are implausibly large . 
71.mp3,He mainly concetrate on the questions asked him at the time of interview . 
72.mp3,becaese when we learn about some subjects we should have more information about what we study so that the student will get the information more easier and more better and this is my first reason . 
73.mp3,In a market economy the price must reflect costs of the product and consumer 's willingness to buy the product . 
74.mp3,some tour guide who will want to set maximum security make tour difficult because you will only have a wonderful view throught the bus . 
75.mp3,Because the fashional culture has been changed . 
76.mp3,actually that was so unstable trip . 
77.mp3,It is obvious that after returning i was tired and the night is meant to sleep ! . 
78.mp3,"Nowadays , we need a person who are capable of all sorts of works . "
79.mp3,"Finally , fish farming relates to long term wastefulness whcih can pollute the sea . "
80.mp3,Establishing connections with other researchers will open the door for new projects with other researchers . 
81.mp3,Now I have outstanding scores . 
82.mp3,He knows that there is no return in his help to others . 
83.mp3,"Furthermore , my friends who are nineteen years old , drive their own car , and they would like to buy always another one . "
84.mp3,"As the cities were smallers , it was less violence , noise , traffic ... "
85.mp3,There can not be no bothering and no hazzle . 
86.mp3,Even though he knows the advertisement is unreal or looks to pretty he is going to buy the product . 
87.mp3,These are several opposing points I observed between lecture and passage . 
88.mp3,"Even though she does not have job , she also need car to use pick up her kids or go shopping . "
89.mp3,"In early industry , a lot of warker worked together . "
90.mp3,It kept Anasazi from living in American Southwest by very high temparture ; it caused droughts . 
91.mp3,I have several reason to support my choice . 
92.mp3,Because one time you get success and next time will why not ? 
93.mp3,"While at university , he might specialize in a subject , while still taking a number of diverse other courses . "
94.mp3,Now we have all information around us . 
95.mp3,Both of these men have dealed with situations in an unconventional manner and the results are with everyone to see . 
96.mp3,this shall effect in exams . 
97.mp3,"Moreover , take risks teaches you to accept both winning and losing , that is the most important lesson one should learn in order to achieve any kind of objective . "
98.mp3,"I would like to initiate , myself , whatever I do on my trip to get much out of my trip . "
99.mp3,"However , one student pointed out my mistakes . "
100.mp3,"It 's normal : propose something to the client and construct something different , is the best way ( and it 's legal ! ! ! ! ! ! ! ! ! ) "
101.mp3,this is how we are transforming our society at the present days The actual fact of being against this statement is that we are looking what we want at the moment in order to have a great time . 
102.mp3,"Not only this , without a clear understanding of what is being taught , the student would not be able to perform well in the tests . "
103.mp3,"for example : a man whose hobbies is playing football , he must want to play the ball day until night and night until day again . "
104.mp3,At least I do in my consulting job . 
105.mp3,"Although the few lucky ones struck gold , most of the people simply vanished as they left their homes , only to be forgotten , and some of them even developed obsessions for the western mirage . "
106.mp3,"And like the citizens of the developed countries , these people want to possess cars themselves . "
107.mp3,we grip on many subject we get ample exopsure greatly and easily . 
108.mp3,"But on the other hand ther is also people that is often convinced by the interesting advertisements they see everywhere , becuase of this many times they have to face problems with the product that they bought and many times ther is no way to give back that product . "
109.mp3,"They take responsible the future of their society and the results , it can the most helpful thing for society . "
110.mp3,So the conclusion is clear . 
111.mp3,and you can change your views and ideas but you can not change ypu fact . 
112.mp3,An old person has to give way to a younger one no matter whether he likes it or not . 
113.mp3,Ever increasing competancy rates force them into frequent business model changes for a compatible trasisional flexibility . 
114.mp3,"However , this reading passage casts douts on the speaker 's mention . "
115.mp3,"However , all of them are limited . "
116.mp3,That is what it gives us a lot of opportunity to think . 
117.mp3,"The placebo effect is not illusion but the real , so the drug was effected the placebo effect . "
118.mp3,"When I go to travel to see something I want , we do not know about when it is open or close even though I study before , it might be suddenly close . "
119.mp3,Its cost is half than other but lifecycle is the same . 
120.mp3,"What we do now , we will able to do later . "
121.mp3,"According to me , there are two kind of studies : the ones highly technical and the others . "
122.mp3,"Thus , we begin to share a information and ask own 's weaker subject . "
123.mp3,"For example , in 2 0 0 6 world cup form Germany , as many conch wanna term work . "
124.mp3,Many Scientists obtained clear results of investigations after the facts were on the table before they could even began to theorise about them . 
125.mp3,This will give rise to a holistic understanding . 
126.mp3,They want to make people understend thet dhe product is the best and really you can trust on it . 
127.mp3,There can be any other theories about migrating reason and about the methods of migrating . 
128.mp3,"Thus , the environmental issue will push more people to consider another way to commute instead of driving a car . "
129.mp3,"On the other hand , he /she can continue doing what they do well and hope to be noticed . "
130.mp3,"Video is convenient , but , if teachers concern about students , so using texetbooks gives good ability for students . "
131.mp3,"They tend to restrict traffic in certain days , hours , increasing parking fees , etc . "
132.mp3,For instance we can consider that evolution exists . 
133.mp3,So depending on the study it would be better oin way or the other one the thing is to choose the right one . 
134.mp3,I am really sorry to continue like this but right now i am taking the test in a room with 5 more person other than me and we all are taking the test with the computer . 
135.mp3,In my opinion it is dependend on particular person . 
136.mp3,Many people killed by car . 
137.mp3,Global warming and green house effects had started recently . 
138.mp3,"Examples : If the good skill people do some thing wrong ways and they got good respond like thife , robber , stolen , criminal and make problems to another people . "
139.mp3,for example when we talk about speed they must anderstand why it is dengures is beteer than if they have axcedant after that they learn . 
140.mp3,Therefore peaple will be able to live with the automobile sosiety and the nature for the future . 
141.mp3,"Then , how about if the talkkative explains the project errounuosly ? "
142.mp3,"One car should be used by three persons , so it is hoped will lessen the number of car during the busy hour . "
143.mp3,And they can make a products and sell it cheaper than most countries . 
144.mp3,"Marco Polo used Persian langage , not Chinese or Mongolian . "
145.mp3,this is because of their knowledge on many subjects . 
146.mp3,"The industry of the fish affect this animals because , this companies used the fish in the elaboration of diferents foods lke oil . "
147.mp3,therefore I brougth a car imidiatly . 
148.mp3,"Although the weatherrealted factors could be considered , such as the land shape of the area . "
149.mp3,The one of the reason that the fish is important is the fish can be a important bay for livestock and poultry . 
150.mp3,Once the policy mention in the reading passage . 
151.mp3,"Such unwritten law is very furious , but our world is the furious . "
152.mp3,Also the youth have less mental pressure . 
153.mp3,Think about creates a fire break . 
154.mp3,"finally the third cause that birds use a type of internal compass , birds have crystals of the mineral magetite embedded in their break . "
155.mp3,If the teacher teach them that they will go to study about that . 
156.mp3,"Just searching the internet , and we will find out what we want , no matter how books will stimulated our imagination and how high quality the book it is . "
157.mp3,in one case for example the copper scroll notes merely that treasure is hidden in the avivinity of a cretain river . 
158.mp3,In this case student learn a concept and it is possible to use in other fields . 
159.mp3,This way is the cheapest way for people to have a trip . 
160.mp3,The lecture says it is more important to provide enough fishes to people . 
161.mp3,"Futhermore , a tour guide will also provide safety and security for the travel , since they know already the do 's and don'ts in the tour . "
162.mp3,On the other hand each academic field needs specialists in order to progress . 
163.mp3,Which caused her situation to be worse . 
164.mp3,For example one man is a football club fans . 
165.mp3,"By using new things , which is usually is un known for them and it includes risk with it . "
166.mp3,"You can see that inmany books , news , newspaper , TV , computer . "
167.mp3,"When many people were very young , they must have mang time to learn knowlegable , They donnot have much time to enjoy life as much as posssbale . "
168.mp3,"This arguement is not only true now , it is since ages , i want to talk on a live example of Sir . "
169.mp3,Last one is they have to study about disease which means that will be save . 
170.mp3,The consumers also know how advertisemnets are . 
171.mp3,-Learn ! 
172.mp3,There are very successful politicians that never tried somthing new . 
173.mp3,You can become smarter than the other people . 
174.mp3,"In my opinion , this statement is groundless and the youngsters today do contribute to their communities to a great extent . "
175.mp3,And now because of this man i am writing my essay by computer . 
176.mp3,"Therfore , we have to reduced sulfur and nitrogen dioxide . "
177.mp3,Most of the the things I hear are not true . 
178.mp3,"I think it is very hard to distribute the point and to make every one to understand , because when few poeple started to do so , they would think it is not fair at all , they are the few who are suffering , other people cannot get it and continue doing the same thing , it just make those people thinks stupid . "
179.mp3,"Maybe at the beginning , but time after timer other animals in the inviroment will choose them as their new food . "
180.mp3,"The older man would prefer to enjoy all the time he has , remembering that we live only once . "
181.mp3,The scraping will causes heat and that heat(energy) will go into the car . 
182.mp3,You will face huge difficulties in life if you dont know at least something from every subject . 
183.mp3,Younger generation are more adaptable thus they can adapt to changing technology . 
184.mp3,"That is why i m here , to be ready for my education , that is , to be specialized in one specific subject that i would like to learn in every details . "
185.mp3,Furethermore the professor denies the reading passage which states that treasure does not exsit and it is just fiction . 
186.mp3,I chose law and began to study everything about italian law . 
187.mp3,But ideas of how you can solve this problem will actually give you a solution to the problem . 
188.mp3,"After all , personally , until now , I try to go on a diet and manage my health condition more carefully . "
189.mp3,"As well as the knowledge plays also important role in the life , which can be aquired by the understanding the concepts rather than learning the things . "
190.mp3,Most people do n't care about the environment or how consuming cars affect the ozone layer greatly . 
191.mp3,In addition it have a nagatice influence on agriculture . 
192.mp3,Also they have more responsibilities than young person . 
193.mp3,"The professor said , This can be changed to the different environments . "
194.mp3,This casts doubt in the reading passage 's assertion that fluoride prevents dental cavities . 
195.mp3,"I , on the other hand , have no major responsibility other than studying . "
196.mp3,the good student must know how to understand and work hard to get the iede . 
197.mp3,And thie critica use few arguments . 
198.mp3,"Secondly , the information in videos is very delivered in format , it very familiar with students . "
199.mp3,It was a reasonable price . 
200.mp3,"Of course , local businesses that depended on park visitors suffered as a result . "
201.mp3,The heart decease patients shows improvement when they are taking placebo . 
202.mp3,"Besides , young people uaually like new-fasion thing , like ipod or mp 3 , I can see that main part of young peole ca n't live happily without music in their ear and movies at home . "
203.mp3,They are go on do it and do it for better . 
204.mp3,"However , people do n't know there and they do n't know how to do is better or what they ca n't to do . "
205.mp3,Producing vehicles that are more fuel efficint will damage roads and that will cost a lot to repair . 
206.mp3,so measures should be taken to check the fish 's population . 
207.mp3,some said this product is recomended for the most important doctor or something like that . 
208.mp3,This creates people to pier pressure . 
209.mp3,And there are a lot of scientist who just specialize in one specific subject discover important concepts or invent things which make our society more convenience . 
210.mp3,"For example , last monthe , i bought a product for skin , actully i bought the product beacuse the adevrtising got my attention . "
211.mp3,"Newer vehicles are something could fly the sky , then we need't annoy about trafic jams . "
212.mp3,This offers you a lot more possibilities and you can stay at places you like and avoid the ones you do n't like . 
213.mp3,But when we are in possetion of these products are we really living a dream ? 
214.mp3,the sulfur dioxide is generate by several natural processes and several human processes . 
215.mp3,Sulfur dioxide is released into the air with other pollutants . 
216.mp3,One without the other is nothing . 
217.mp3,menhadens are the primary source of protein for the livestocks and poultry . 
218.mp3,"I understand people who think that funny movies are more interesting than the others especially when you watch a movie with friends , because it allows to have fun with them . "
219.mp3,"In fact , old buildings are costly to maintain . "
220.mp3,"While the child spends about five hours or less with his parents , and whenever that child wants to go out he will most probably go out with his friends which are his classmates , so most of his school life will be spent with his classmates , and this will have a great affect on his personality which will determine the way the child will react towards his school and will determine how he will use his life . "
221.mp3,They have a broader spectrum of ideas that they can develop into competences throughout their student life . 
222.mp3,"someone likes music and someone like science , and some one is talent on ballet while someone is not . "
223.mp3,I believe that the number of cars may decrease in twenty years ' time for some reasons . 
224.mp3,"This could help them to develop their thinking power , managing power , and good strategy making power to achieve their goals . "
225.mp3,A perfect example of Real Politik was when Bismarck manipulated the letter written by the king and sent it to the French emperor Napoleon III . 
226.mp3,In this case a tour guide can be helpful to complete the trip in very less time as compared to what one might end up spending if one decides to explore the place himself/herself . 
227.mp3,"What I wanted to say is , that enjoying life cannot be putted into a definition to test out if somebody is enjoying his or her life because it matches this definition . "
228.mp3,"But the owner that posses one car dealer shop offert to him other job , with better conditions and benefits . "
229.mp3,It 's is very obbvious that more cars will be sold there . 
230.mp3,"Also , food chain becomes more stronger that is was before , such as rabbits and hear . "
231.mp3,"For the older , the phone , the only funciton , in some means , is a job , a project , a imper wich master call on him with the related to the jobs . "
232.mp3,"According to me , in order to start the carrier through the success it`s importand to have a solid base , that means knowledge and experience . "
233.mp3,"Therefore , I support the statement that it is more important to understand ideas and concepts than it is to learn facts . "
234.mp3,"Yes that 's right but there are some young people people think about the idealism of his country about their comunities in Indonesia about their friend who ca n't eat , who ca n't go to school . "
235.mp3,The time to take a risk can be compensated with consulting others who are more professional than me in sorting out the issues or solving the risky problems . 
236.mp3,"However , after prescribed burning , the forests can grow up plentiful , and farmers can get works more than before . "
237.mp3,maybe be doing what they already know how to do well is better than to b enneoyed with something sounds news 
238.mp3,"But in general , lies do not last very long . "
239.mp3,Techology has grown so fast because everyone tries to work on an invention due to some ideas he has developed and concepts that have been applied to this idea from different subject areas . 
240.mp3,Hence from the very beginning children form this hesitancy from interaction with other people which time only solidifies . 
