file_name,transcription
241.mp3,He actually changed the way he played in the latter part of his career when he won all those championships . 
242.mp3,We will continue to invent and produce more sofisticated technology based on our own comfort which will decrease our ability to perform physical activities . 
243.mp3,Facts are learned by experinces . 
244.mp3,"In my opinion , if they start one subject , never give up . "
245.mp3,This contradicts the reading passage 's that it has bad influences to economics . 
246.mp3,"The purpose of travel is owning a lot of your time to release mind , is n't it . "
247.mp3,"The bass is not only predetor for menhaden , so if people catch more basses the population of another fishes also will grow up . "
248.mp3,"They are today using this way as a curative measure but with increasing importance of preventive medicine , normal , healthy individuals are also attracted towards not using cars wherever possible . "
249.mp3,"This shows that people are aware of the disadvantages of getting old &raspsquo; among them getting less pleasure from life , and try to delay or disguise it in any possible way . "
250.mp3,"Infact we will need a lot of place were parking all this cars , so we need a lot of project for this incrismt of cars . "
251.mp3,Government use that money in public use and safty . 
252.mp3,"Second , Sphinx is known for Old Kingdom king . "
253.mp3,"Or , "" Is this the right thing to do ? "" "
254.mp3,"I stated to have been interest in math , I spent lot of time to solve math problemes and I got good score at exam , it make have more passion about math . "
255.mp3,Even after school he has to participate in games and other extra curricular activities that are compulsory to attend . 
256.mp3,he has a lot of money and name but no family life . 
257.mp3,"Even though the place I went was Kyoto which is most beautiful city in Japan and they have most valuable and interesting temples , nothing really remein in my mind after the trip because I was just part of the group and following a tour guide without thinking . "
258.mp3,Board knowledge on may subjects is not possiable to acqurie . 
259.mp3,"I also think that the AD is a method to feel happy the people , because you can dream ... "
260.mp3,It is more exciting and memorable . 
261.mp3,The first clue is that there are rocks near the coast which are considered to be made by Chinese explorers . 
262.mp3,"however , his trying still bring him to success "
263.mp3,"Since I was in a group , I should respect the group rule . "
264.mp3,One good way to be always safe and have a good time is to travel with a group and chose a good tour guide . 
265.mp3,"I think that there are not anything I want , what a tired city , why my father and mother want to visit this city ? "
266.mp3,The lecturer against the authour 's insistments following reasons . 
267.mp3,"In addition , once he told me that he will never take risks of doing other works because he 's been working for it for 1 2 years and he is already &raspsquo; fluent &raspsquo; at it . "
268.mp3,"For example , the most famous Thomas Edison was asked a question when he applied for a loan to a bank one more time for his experiments which were failing . "
269.mp3,They behave as though they were just spontaneously praising a product during noring normal conversation . 
270.mp3,To my surprize nothing happened . 
271.mp3,"For example , they do not like to wait much . "
272.mp3,But like the lecturer suggest we could susidise the poor and this policy help to put the right prices to our natural resource and environment . 
273.mp3,There are cars that use gas to power them . 
274.mp3,They can bring that problem to improve for many company that will produce a new product . 
275.mp3,Education is the basis of opportunities and the amount of subjects in which a person has knowledge conditions his or her opportunities in very important aspects of life like work and even helping others . 
276.mp3,It usually makes them to be more postive to do it . 
277.mp3,In both advertisements is said that these tooth pastes will make your teeth briliant and brighter . 
278.mp3,We must trust ourselves 
279.mp3,That seems why people live for . 
280.mp3,Insufficient closet space inefficient heating and decaying plumbing makes life harder to live in old houses . 
281.mp3,"The advertisemnet says that the car has space for 1 0 people when thhe truth is that the car is just 4 people space , another example is an advertisement of a skin soap , they said that this soap is the best because they say your skin wil be as soft as a fifteen years old princess , or that your skin will be as soft as the Jennife Lopez 's skin . "
282.mp3,That means people have something that is specializing in one subject could get more chance of hirring . 
283.mp3,And Chimps can also remember what researchers said and almost perfect reply what researchers said . 
284.mp3,He will conceder him self losing the years that he spent on colecting the money . 
285.mp3,In addition the technology on which these mass transport systems function are based primarily on non-conventional sources of energy . 
286.mp3,"First of all , old houses are not necessarily suited to the needs of mordern residents . "
287.mp3,Of course he has the risk of failing but imagine the fantastic sensation of victory if his second bakery is as much as successful as the first one . 
288.mp3,There are many people that do n't think before take a choose . 
289.mp3,"Third , although the reading passage claims dinosaurs because their bone structure is similar to endothermy , scientist assume that it is not the case . "
290.mp3,"Ten years ago , a family that consists of five members owns at least two cars and it satisfies the transportation . "
291.mp3,For example we can see on the discovery channel in wild life many people are hobbies to learn from the animals . 
292.mp3,Actual market requires more specific knowledge that broad knowledge . 
293.mp3,Only by braking out of your normal life you can discover new perspectives in your job and your private area . 
294.mp3,I sad yes . 
295.mp3,when you be successful you will have a reasons for live . 
296.mp3,And the important is travel without the tour guide . 
297.mp3,Fish firming uses the lots of special products such as fish meal . 
298.mp3,Lawyers are young people . 
299.mp3,Extending the same example as stated above i can tell you during the most worst period of Amitabh Bacchan he was offered to enter into politics to take advantage of his publicity that he had got and he will be paid for it heavily so he was very much in need of financial support Mr. Bacchan had rejected this offer only because he knew that how polititians play with the imotions of common people . 
300.mp3,"and when we want got those energy , we need desport the ground and soil or oceans , because those energy were found in those palce . "
301.mp3,New plant could not grow after the fires . 
302.mp3,Realist people can be more successfull as we can see in history . 
303.mp3,They are not stop at the same . 
304.mp3,"It means , to understand an war development , you should understand the ideas and cultural moviments that resulted in a particular period , and helped for the occuring of that war , for exemple . "
305.mp3,In the commercials they are all good . 
306.mp3,"alternative Reading passege emphesize about alternative to priscibing burning by giving some turm like "" disking "" in this fire clear out dry and dead shrub and stimulate the growth of new plant life . "
307.mp3,"This saved valuable time , one can invest in more important activity . "
308.mp3,"But , even if this student passes the course , he/she will not be a succesfull lawyer in the future about contracts . "
309.mp3,"In other words , the verity of these towns would give some changes that might use to encurge people who are interested in old things . "
310.mp3,"However , there were n't any particles . "
311.mp3,That shows that few animals could sustain and active in this harsh and cold environment . 
312.mp3,"The way I see it is that , the only thing that guides do is limit you , and even more when your in a group . "
313.mp3,The facts were n't as important as the context . 
314.mp3,These ideas and concepts usually contain academic research which are totally reliable and dependent on the facts . 
315.mp3,From this professor agreed some ideas and dis agreed some ideas . 
316.mp3,"But , I went to Juju island more than three times . "
317.mp3,i would have a variety of answers subjective to every person field of interest . 
318.mp3,"The second one is to specialize in one specific subject , one has his own tast in studing , so let us talk about this subject "
319.mp3,"I think that the car , twenty years from now will use electric fuel not gasoline . "
320.mp3,"After this effort , many companies in the world startet actions to get this ecocertify . "
321.mp3,is it right ? 
322.mp3,Any user who has used any toothpaste definelty knows that this can never be true . 
323.mp3,"After the contruction in 1 9 0 8 of the first commercial car the ford T , man -kind has been subdued to the use of the car . "
324.mp3,Everybody loves him and he does the same . 
325.mp3,Successful people had gone through lots of hardship . 
326.mp3,"Younger people are still trying to obtain experince although , olde have it already . "
327.mp3,hence ideas and concepts are more reliable than the facts . 
328.mp3,This has to do with the signs of our nature that we encounter nowadays . 
329.mp3,"For example , drivers might memorize where the speed camera is located . "
330.mp3,"Take toys for example , advertisments that target children in particular are the best example of the way advertisements create a false image of the product . "
331.mp3,"The cars were our answer to the needs to transportation sixty years ago , and they will continue to be twenty more years from now . "
332.mp3,"They need the cars fore many things sathsh as trasportation , inter tanmant and bisnes . "
333.mp3,"Because of the requirement of men going to army , men have to sacrifise their preciouse time of youth . "
334.mp3,If scientist will do something different like if he/she can modify the form of carbohydarte like gelatinized and nongelatinized carbohydrate then incorporated in fish feed then fish may be utilize more than previous then if fish utilize more then chances of growth will be more then it may be appreciated by everyone . 
335.mp3,"While turned out reaults from both experiences are same , the method and the time that brings a result is not same . "
336.mp3,"Because you do not need to be a hero in order to try new things , you just need to want it and know that any result will be a succes in things that you want or in learning . "
337.mp3,They have to consider the negative side of their suggestion . 
338.mp3,In a such situaction there is no other way . 
339.mp3,In the reach family all the components have a cars . 
340.mp3,I held the map and tried to find all the famous points that had marked on it . 
341.mp3,Even the magnitides on Mars are no evidence of life on Mars . 
342.mp3,"For example , When I traveled France and Italy alone , I met a person in NIce who was a famous producer of the song in Taiwan . "
343.mp3,Finding oil and petrol and digging for it is a very expensive procedure . 
344.mp3,I hope those things I learned will help me in the future . 
345.mp3,"for this reasons , the passage said that it is time for state to take measures to reduce the quantity of sulfur dioxide . "
346.mp3,i think there must be many subject better than one subject . 
347.mp3,Also the animal population got better and they recovered really good after the fire . 
348.mp3,It provides much wood to the industries . 
349.mp3,SOME LUCE POINTS INWALL . 
350.mp3,The gas from cars will destroy the environment of the earth and it will heat earth up . 
351.mp3,"in writting we are nearly unable to show the felings of people , but in the action on TV we can understand well than book . "
352.mp3,These kind of fish ca n't live so long in water that contain salt . 
353.mp3,"Every body no that the trueth today is a compitition maket in each and every field we are faceing compitition , for example if you are choosing you carree in software field than you have to master on that subject , than you can easily get a job . "
354.mp3,"Because you share only a single interest , thus making you a loner . "
355.mp3,"In addition , students want to learn the language and they want to use it , so when they understand the concepts and the ideas it will help them to learn the language . "
356.mp3,"In deed , they can be refuced . "
357.mp3,Unfortunately we are individuals and living isolated on the society . 
358.mp3,but if they needs money for these perpose they can do a extra hardwork . 
359.mp3,Learn 
360.mp3,"However , after I learned all sides happening in a company such as marketing , accounting , leadership , financial accounting , and business communication etc. . "
361.mp3,An example that confirms or supports my point is clear in the chinese cars . 
362.mp3,"Furthermore , it is way better to live on knowledge than on guess and common facts that anyone could learn through the medias . "
363.mp3,It is the main resource for the cars to be working . 
364.mp3,"From my personal experience , when I was very busy to find the information , the Internet very useful and fast tool . "
365.mp3,"But then as it has been rightly said by someone "" We are the victims of our own greedy needs "" . "
366.mp3,This is very useful for them . 
367.mp3,But by then we have already bought the product and end up loosing the money . 
368.mp3,and we says that these countries gonna be the next developed countries . 
369.mp3,My 1 0th exam and 1 2th exam is very good . 
370.mp3,if they do thing they go for another untill they know how it woek and what is useful think of it . 
371.mp3,"I am sure that most of the kid knew that this was not the way their parents teached them , because they do not know why was it wrong or why should they do the ways their parents told . "
372.mp3,we can see young people working over countries or working for others with tools like telephones or internet even if they look they spend their time just for themselves by being whole day in their room . 
373.mp3,"Also , most of people prefer to entertain athletics rather than other arts . "
374.mp3,"There fore , he likes to do arisky and strainge things and he enjoy it . "
375.mp3,"But after a few days , I found myself enjoying in it . "
376.mp3,"However , what if they just work for the field which they already know how to do well , they might feel sad and tired . "
377.mp3,I belive to have broad knowledge to specialize in one specific subject have outweigh than to have broad knowledge of many academic subjects . 
378.mp3,In my opinion if someone thinks one is more important than other why not to focuse on one ? 
379.mp3,And people feel more arkward when it comes to their ears that this is something going on as a current event . 
380.mp3,He would never want his business or company to be stagnant . 
381.mp3,"However , I woud prefer traveling by myself with the good prepation filled with joy . "
382.mp3,the carebendiocside is very harm full for the people . 
383.mp3,"and i had listen "" success attract success and money attract money "" "
384.mp3,Also they can go for shopping and buying a new fashionable clothes . 
385.mp3,It 's really a good film . 
386.mp3,After that i studied in more depth to the topics and understood the ideas and concept of the topic . 
387.mp3,When the forest is caught on fire the wood turns into ashes which is pottesium . 
388.mp3,"In my opinion , cars will be took full use of in the twenty years . "
389.mp3,in the fact the matter that alot of acadmic subject can not be used seperatley . 
390.mp3,"According to the lecture , management should plan carefully when hire well-trained people or teach them how to manage the fire in a better way before fire . "
391.mp3,And it is important to have emotions in classes like history or social studies . 
392.mp3,In the oldage the people have leave all the burdens and they are spending their own interested work . 
393.mp3,"Every time when we meet , I will look forward to the new things . "
394.mp3,Althogh some people say that the treasures are already found . 
395.mp3,"As far as I am concerned I agree with this statement , however some people are not agree with my opinion . "
396.mp3,"Carusage in the United States is very important in every day life , aswell as in many latinamerican countries , and thirdworld countries . "
397.mp3,"However , companies tend to cut thier profits for workers . "
398.mp3,Many people are willing to buy these cars . 
399.mp3,The one is the Copper Scroll . 
400.mp3,"Another sollution could be the developing of more fuel efficient cars , wich could also be good for America 's car manifacturers who will produce more attractive cars to sell to other countries . "
401.mp3,"Consequently , I agree the statement with regard to three reasons : effecting of view , face to face with people and the first time . "
402.mp3,"First of all , the population of the world is going down . "
403.mp3,My wife and I always go to Tokyo around December . 
404.mp3,Thereby the problem of running out of fuels is out of the question thereby augumenting my view that the number of cars will continue to rise and not decline . 
405.mp3,First effection is grobal warming . 
406.mp3,"So , Ho Chi Minh city will develope "
407.mp3,Peolple like to drive different types of models and they want some thinmg extra in it . 
408.mp3,"These useful skills that I learned from reality are going to be the greatest gift for my future career , and they can not be found in the text books anyways . "
409.mp3,That 's why i will not hard as i am alon . 
410.mp3,High cost produces high quality medicine . 
411.mp3,This is important thing . 
412.mp3,books some times have an old information so it will be wrong . 
413.mp3,"Against those problems , people started to use cheaper transportation instead of car . "
414.mp3,"however , I agree that having knowledge is being useful whenever we necessary information . "
415.mp3,"But when teacher ask me did I understand it , I said yes . "
416.mp3,So i disagree with the statement and i think it is much better to specialize in one specific subject than to have a broad knowledge of many academic subjects . 
417.mp3,Raising tax for the gas can be the most effective and possible way to decrease the use of gas in three reasons . 
418.mp3,"Next , kids are more attractive to the advertisements . "
419.mp3,Successful People are explain any oher mater and discuss any other problem . 
420.mp3,"But it dengerous , because some driver make trobull with other driver and they when some driver crash their car then streets are busy . "
421.mp3,Because it is allready a fixed data so nobody can creat problem with this type of litreture . 
422.mp3,"Also , the professor indicates prescribed fire should be carful when we use prescribed fire solution . "
423.mp3,"If they cannot pay the high prices any more , people have to change into a bus or a train . "
424.mp3,This will reduce the pollutions caused y the carbones from the cars . 
425.mp3,Moreover they have to learn aboue advance course material . 
426.mp3,"The age , in my view , sometimes is a barrier to do somethings in life . "
427.mp3,In simple words they say they lost their appeal . 
428.mp3,"For example , nursing students study in a nursing college for three-four years . "
429.mp3,"I believe , that the product 's quality mentioned in the shops are exactly the same as given in the adds . "
430.mp3,"Then , define your goals and work hard to achieve them . "
431.mp3,"Critics of this policy focus in three poins ; first , Yellowstone fires scorched a large area of land therefore a lot of plant species were lost . "
432.mp3,"In my past experiences , there are some lecture which is completely baed on facts , and the chance for me to apply them is just rare . "
433.mp3,When you understad de idea is one way that you can figurout about the statement that you see in these moment . 
434.mp3,"However , a lot of reasons explain about that the placebo effect does . "
435.mp3,In todays world there is a high and almost unreplenishable thirst for change . 
436.mp3,The kids can stay outside every day and play . 
437.mp3,"Firstly , I think that communities equal human rerationship . "
438.mp3,It may spoil the health also . 
439.mp3,Water is needed for alive . 
440.mp3,"I the same other people see many tims on TV rich people are intrested in politica , sports new technologies and also in spaise . "
441.mp3,"As a result , studies in britain have shown that fluoride increases the activity can lead to more bone density and therefore less bone fractures among the elderly . "
442.mp3,"Also , sometimes , people may meet some new friends in the traveling group . "
443.mp3,"If students just learn facts , they will forget them soon , but this will not happen so easily if they understand properly the concepts that are behind the facts . "
444.mp3,As on when i started completing my home work on time i gradually improved . 
445.mp3,"becase if study in this way of cours , I will gante so much , I also will have alot of information the book I study . "
446.mp3,"When you understand the concepts and ideas is up to you to prove them , to see if they are really what you have been told , i think this is the main reason why students prefere facts rather than just understanding ideas and concepts . "
447.mp3,"for example , if you are attempting to study arts and scienses and to get equalifications in both , you are extraordinary creation . "
448.mp3,"Therefore , as long as it is a country where I can understand their language , I will travel alone . "
449.mp3,Gouverment will try to do something to not pollute the air . 
450.mp3,So in this field it is very importnat to understand all concepts and idease which they gave us and use to solve problems . 
451.mp3,Because they sent out 2 0 % of the whole carbon emission . 
452.mp3,"Try to combine the process of My opinion is so easy to understand one thing ( process , as i mean ) than to remember many divided facts or dates . "
453.mp3,It is also take risks raher than only doing . 
454.mp3,No scientist would have ever come up with their wonderful inventions and the world would have never progressed . 
455.mp3,"There will be a technological development in the future , but that will only promote the use of public transportation system , but not car . "
456.mp3,Not being with a guide gives you the liberty to visit the places you want to visit at your own pace and with the liberty to deliberate to any place you want to go . 
457.mp3,"Usually in the advertisements a presentable face is used they try to present some modals , nice babies , known faces as sports men , only to let the product looks better than it was . "
458.mp3,Not that bungee jumping is something that every young person wants to do but even if he wanted to do it he probably would n't be able to . 
459.mp3,"Close-up video clips of a juicy hamburger flying around the screen , surely satisfying the models eating it could easily create in the viewers a false sense of being hungry and urge them to hop into their car and drive to a fast food restaurant nearby to get what they have seen . "
460.mp3,So only time will tell what actually happens . 
461.mp3,"As we all known when we were out something we ca n't expect would happen , such as disease , accident or something else . "
462.mp3,"and then , makers of cars need to develop the systems for safe almost completely . "
463.mp3,"Third , the proffeser agrees that the the gas prices in the United States are cheep , and they should rais them to safe the enviroment and people 's healths . "
464.mp3,"Now a days , there are many people who think they are the most important thing and they only have to work for themselves . "
465.mp3,"in general , there are many peples in a book . "
466.mp3,But they do things in a different maner than others which gives them success . 
467.mp3,People feel more secure and comfortable to tarvel with their own car rather that changing several public transportation vehicles and reach their destination far later that they would desire . 
468.mp3,The second critic of this method is that the costumer lose all critical reflex and that he is not in guard . 
469.mp3,"As a result , it will be easier for you to learn many things . "
470.mp3,"In short , these were critical parts that contradicted the reading materials . "
471.mp3,"I think it 's harder for successful preson to risk somethnig , thay coluld lost much more then others . "
472.mp3,"we can have glance on , what is happening in the world through accessing internet in mobile also . "
473.mp3,So the importance of communities in sosiety decreased . 
474.mp3,but found that successful people use the people money and use there idea for a way to success . 
475.mp3,"In my case , when I did a job interview , the employer ask me question about commensence like society , policy , art , and so on . "
476.mp3,At some time they have to face the failure 's and lot of strugles . 
477.mp3,Because it transmit the hebitats from Eastern Europe to different places in the world . 
478.mp3,Considering a family going shopping in weekend . 
479.mp3,the another reason is many people see some of exutic cars as luxery encorragies the industries . 
480.mp3,Now the market is occupied by lots of cars with varying comforts . 
481.mp3,"It is also undeniable that if a man has diversifed knowledge , it would be immediate use . "
482.mp3,"In my opinion , I think advertisements are make products seem much better than they really are . "
483.mp3,"So , some people use car only by move somewher . "
484.mp3,They have to think twice before performing even routine activities of life . 
